title,price,images,tab,categories
Omega,30,https://raw.githubusercontent.com/wpmaps/sample-data/master/products-images/watches/omega-147.png,Omega,Omega
"Citizen Women's Quartz Strap, Silver",29,https://raw.githubusercontent.com/wpmaps/sample-data/master/products-images/watches/citizen-womens-quartz-st-148.png,Citizen,Citizen
Swatch Black Rebel SUOB,30,https://raw.githubusercontent.com/wpmaps/sample-data/master/products-images/watches/swatch-black-rebel-suob-149.png,Swatch,Swatch
Bulova Women's Swarovski Crystal Quartz Watch,21,https://raw.githubusercontent.com/wpmaps/sample-data/master/products-images/watches/bulova-womens-swarovski-150.png,Bulova,Bulova
Bulova Women's Watch With Ceramic Strap,43,https://raw.githubusercontent.com/wpmaps/sample-data/master/products-images/watches/bulova-womens-marine-sta-151.png,Bulova,Bulova
Michael Kors Womens MK Portia,22,https://raw.githubusercontent.com/wpmaps/sample-data/master/products-images/watches/michael-kors-womens-mk-po-152.png,Michael,Michael
Swatch Golden Dial Golden Ladies Watch SUOK,40,https://raw.githubusercontent.com/wpmaps/sample-data/master/products-images/watches/swatch-golden-dial-golden-153.png,Swatch,Swatch
Citizen Women's Eco Drive Diamond Accented Watch,36,https://raw.githubusercontent.com/wpmaps/sample-data/master/products-images/watches/citizen-womens-eco-drive-154.png,Citizen,Citizen
Swatch Unisex GG Shunbukin Analog Display Quartz,44,https://raw.githubusercontent.com/wpmaps/sample-data/master/products-images/watches/swatch-unisex-gg-shunbuki-155.png,Swatch,Swatch
Fossil Women Neely And Leather Casual Quartz Watch,15,https://raw.githubusercontent.com/wpmaps/sample-data/master/products-images/watches/fossil-women-neely-stainl-156.png,Fossil,Fossil
Casio G Shock GA GB Garish Series Watches,17,https://raw.githubusercontent.com/wpmaps/sample-data/master/products-images/watches/casio-g-shock-ga-gb-garis-157.png,Casio,Casio
Swatch Women's Watch With Silicone Bracelet GWO,24,https://raw.githubusercontent.com/wpmaps/sample-data/master/products-images/watches/swatch-womens-digital-qu-158.png,Swatch,Swatch
Swatch Twice Again SUOB,12,https://raw.githubusercontent.com/wpmaps/sample-data/master/products-images/watches/swatch-twice-again-suob-159.png,Swatch,Swatch
Gucci G Frame Watch,22,https://raw.githubusercontent.com/wpmaps/sample-data/master/products-images/watches/gucci-g-frame-watch-160.png,Gucci,Gucci
Gucci G Timeless' Quartz Silver Toned Women's WatchModel YA,28,https://raw.githubusercontent.com/wpmaps/sample-data/master/products-images/watches/gucci-g-timeless-quartz-161.png,Gucci,Gucci
Fossil Women's Jacqueline Hybrid Smartwatch,32,https://raw.githubusercontent.com/wpmaps/sample-data/master/products-images/watches/fossil-womens-jacqueline-162.png,Fossil,Fossil
Omega Speedmaster Chronograph Automatic Mm Watch,14,https://raw.githubusercontent.com/wpmaps/sample-data/master/products-images/watches/omega-speedmaster-chronog-163.png,Omega,Omega
Michael Kors Women's Sofie Quartz Watch,40,https://raw.githubusercontent.com/wpmaps/sample-data/master/products-images/watches/michael-kors-womens-sofi-164.png,Michael,Michael
Citizen Watches EW D Silhouette,36,https://raw.githubusercontent.com/wpmaps/sample-data/master/products-images/watches/citizen-watches-ew-d-silh-165.png,Citizen,Citizen
Citizen Watches Men's AR E Eco Drive,21,https://raw.githubusercontent.com/wpmaps/sample-data/master/products-images/watches/citizen-watches-mens-ar-166.png,Citizen,Citizen
Swatch Big Bold Quartz Silicone Strap,40,https://raw.githubusercontent.com/wpmaps/sample-data/master/products-images/watches/swatch-big-bold-quartz-si-167.png,Swatch,Swatch
Omega Unisex,16,https://raw.githubusercontent.com/wpmaps/sample-data/master/products-images/watches/omega-unisex-168.png,Omega,Omega
Fossil Women's Jesse Glitz Dress Quartz Watch,13,https://raw.githubusercontent.com/wpmaps/sample-data/master/products-images/watches/fossil-womens-jesse-stai-169.png,Fossil,Fossil
